Master/experiments/results/user_proto_hm_3_month_s38210573/test_metrics.json

{
  "ndcg@1": 0.1074635470839615,
  "hit_ratio@1": 0.1074635470839615,
  "ndcg@3": 0.18167829227243176,
  "hit_ratio@3": 0.23707737796112988,
  "ndcg@5": 0.21995299499753304,
  "hit_ratio@5": 0.33039606390314025,
  "ndcg@10": 0.27395185993215415,
  "hit_ratio@10": 0.498112590134047,
  "ndcg@50": 0.36890063134735407,
  "hit_ratio@50": 0.9206430828084036,
  "test_loss": -13.535404143518845
}

Master/experiments/results/user_proto_hm_3_month_s38210573/summary.md

## All Test Metrics

- **hit_ratio@1:** 0.1075
- **hit_ratio@10:** 0.4981
- **hit_ratio@3:** 0.2371
- **hit_ratio@5:** 0.3304
- **hit_ratio@50:** 0.9206
- **ndcg@1:** 0.1075
- **ndcg@10:** 0.2740
- **ndcg@3:** 0.1817
- **ndcg@5:** 0.2200
- **ndcg@50:** 0.3689
- **test_loss:** -13.5354