Master/experiments/results/user_proto_hm_3_month_s38210573/val_metrics.json

{
  "ndcg@1": 0.11122278448467283,
  "hit_ratio@1": 0.11122278448467283,
  "ndcg@3": 0.18805127345054826,
  "hit_ratio@3": 0.2454489853954601,
  "ndcg@5": 0.22717248458102018,
  "hit_ratio@5": 0.3408790772143466,
  "ndcg@10": 0.28139424462945467,
  "hit_ratio@10": 0.5091877320306505,
  "ndcg@50": 0.374897927321935,
  "hit_ratio@50": 0.9246399507598334,
  "val_loss": -13.604966424160441
}

Master/experiments/results/user_proto_hm_3_month_s38210573/summary.md

## All Validation Metrics (at best checkpoint)

- **hit_ratio@1:** 0.1112
- **hit_ratio@10:** 0.5092
- **hit_ratio@3:** 0.2454
- **hit_ratio@5:** 0.3409
- **hit_ratio@50:** 0.9246
- **ndcg@1:** 0.1112
- **ndcg@10:** 0.2814
- **ndcg@3:** 0.1881
- **ndcg@5:** 0.2272
- **ndcg@50:** 0.3749
- **val_loss:** -13.6050