Master/experiments/results/mf_ml-1m_s38210573/test_metrics.json

{
  "ndcg@1": 0.09032151143520054,
  "hit_ratio@1": 0.09032151143520054,
  "ndcg@3": 0.1558436388956645,
  "hit_ratio@3": 0.20500497182631752,
  "ndcg@5": 0.1892255664846501,
  "hit_ratio@5": 0.2863771958899569,
  "ndcg@10": 0.23570043882546624,
  "hit_ratio@10": 0.43072588664235995,
  "ndcg@50": 0.33436339998500997,
  "hit_ratio@50": 0.8773616175008286,
  "test_loss": 4.422627151012421
}

Master/experiments/results/mf_ml-1m_s38210573/summary.md

## All Test Metrics

- **hit_ratio@1:** 0.0903
- **hit_ratio@10:** 0.4307
- **hit_ratio@3:** 0.2050
- **hit_ratio@5:** 0.2864
- **hit_ratio@50:** 0.8774
- **ndcg@1:** 0.0903
- **ndcg@10:** 0.2357
- **ndcg@3:** 0.1558
- **ndcg@5:** 0.1892
- **ndcg@50:** 0.3344
- **test_loss:** 4.4226