Master/experiments/results/mf_ml-1m_s38210573/val_metrics.json

{
  "ndcg@1": 0.09695061319191249,
  "hit_ratio@1": 0.09695061319191249,
  "ndcg@3": 0.16321065281204306,
  "hit_ratio@3": 0.21345707656612528,
  "ndcg@5": 0.19549415772549977,
  "hit_ratio@5": 0.2921776599270799,
  "ndcg@10": 0.24305386024917197,
  "hit_ratio@10": 0.4400066291017567,
  "ndcg@50": 0.34308710647222873,
  "hit_ratio@50": 0.8912827311899237,
  "val_loss": 4.410199244817098
}

Master/experiments/results/mf_ml-1m_s38210573/summary.md

## All Validation Metrics (at best checkpoint)

- **hit_ratio@1:** 0.0970
- **hit_ratio@10:** 0.4400
- **hit_ratio@3:** 0.2135
- **hit_ratio@5:** 0.2922
- **hit_ratio@50:** 0.8913
- **ndcg@1:** 0.0970
- **ndcg@10:** 0.2431
- **ndcg@3:** 0.1632
- **ndcg@5:** 0.1955
- **ndcg@50:** 0.3431
- **val_loss:** 4.4102