Master/experiments/sc8_dc05_control/lightfm_hist_ids_hm_1_month_s38210573/val_metrics.json

{
  "ndcg@1": 0.251913699637691,
  "hit_ratio@1": 0.251913699637691,
  "ndcg@3": 0.3602920004779417,
  "hit_ratio@3": 0.43885695605982183,
  "ndcg@5": 0.40059051019977043,
  "hit_ratio@5": 0.5368165844888174,
  "ndcg@10": 0.44370772606012826,
  "hit_ratio@10": 0.6699855621237298,
  "ndcg@50": 0.502566613806903,
  "hit_ratio@50": 0.9305619875234956,
  "val_loss": 3.358926298726311
}

Master/experiments/sc8_dc05_control/lightfm_hist_ids_hm_1_month_s38210573/summary.md

## All Validation Metrics (at best checkpoint)

- **hit_ratio@1:** 0.2519
- **hit_ratio@10:** 0.6700
- **hit_ratio@3:** 0.4389
- **hit_ratio@5:** 0.5368
- **hit_ratio@50:** 0.9306
- **ndcg@1:** 0.2519
- **ndcg@10:** 0.4437
- **ndcg@3:** 0.3603
- **ndcg@5:** 0.4006
- **ndcg@50:** 0.5026
- **val_loss:** 3.3589