Master/experiments/sc8_dc05_control/lightfm_hist_ids_hm_1_month_s38210573/test_metrics.json

{
  "ndcg@1": 0.2330627366585851,
  "hit_ratio@1": 0.2330627366585851,
  "ndcg@3": 0.33980710379179424,
  "hit_ratio@3": 0.4174044512244954,
  "ndcg@5": 0.3792407257614406,
  "hit_ratio@5": 0.5133073633168977,
  "ndcg@10": 0.4222959936879127,
  "hit_ratio@10": 0.646353755209894,
  "ndcg@50": 0.4844791752757415,
  "hit_ratio@50": 0.9218992617614209,
  "test_loss": 3.472844676273625
}

Master/experiments/sc8_dc05_control/lightfm_hist_ids_hm_1_month_s38210573/summary.md

## All Test Metrics

- **hit_ratio@1:** 0.2331
- **hit_ratio@10:** 0.6464
- **hit_ratio@3:** 0.4174
- **hit_ratio@5:** 0.5133
- **hit_ratio@50:** 0.9219
- **ndcg@1:** 0.2331
- **ndcg@10:** 0.4223
- **ndcg@3:** 0.3398
- **ndcg@5:** 0.3792
- **ndcg@50:** 0.4845
- **test_loss:** 3.4728