Master/experiments/results/item_proto_hm_3_month_s38210573/val_metrics.json

{
  "ndcg@1": 0.06684430524228577,
  "hit_ratio@1": 0.06684430524228577,
  "ndcg@3": 0.13448599411746243,
  "hit_ratio@3": 0.18350532331389438,
  "ndcg@5": 0.17268731813374022,
  "hit_ratio@5": 0.27421786436359813,
  "ndcg@10": 0.2283234822425817,
  "hit_ratio@10": 0.4418915391837196,
  "ndcg@50": 0.31392558623128153,
  "hit_ratio@50": 0.8034951168869618,
  "val_loss": 0.7375291251946066
}

Master/experiments/results/item_proto_hm_3_month_s38210573/summary.md

## All Validation Metrics (at best checkpoint)

- **hit_ratio@1:** 0.0668
- **hit_ratio@10:** 0.4419
- **hit_ratio@3:** 0.1835
- **hit_ratio@5:** 0.2742
- **hit_ratio@50:** 0.8035
- **ndcg@1:** 0.0668
- **ndcg@10:** 0.2283
- **ndcg@3:** 0.1345
- **ndcg@5:** 0.1727
- **ndcg@50:** 0.3139
- **val_loss:** 0.7375