Master/experiments/results/item_proto_hm_3_month_s38210573/test_metrics.json

{
  "ndcg@1": 0.06326426465031301,
  "hit_ratio@1": 0.06326426465031301,
  "ndcg@3": 0.1256472458531813,
  "hit_ratio@3": 0.1713550005648595,
  "ndcg@5": 0.16313964814354665,
  "hit_ratio@5": 0.2611598708224744,
  "ndcg@10": 0.21913810592032487,
  "hit_ratio@10": 0.4312721804745599,
  "ndcg@50": 0.30452673180188783,
  "hit_ratio@50": 0.7929575654165741,
  "test_loss": 0.7703359604832658
}

Master/experiments/results/item_proto_hm_3_month_s38210573/summary.md

## All Test Metrics

- **hit_ratio@1:** 0.0633
- **hit_ratio@10:** 0.4313
- **hit_ratio@3:** 0.1714
- **hit_ratio@5:** 0.2612
- **hit_ratio@50:** 0.7930
- **ndcg@1:** 0.0633
- **ndcg@10:** 0.2191
- **ndcg@3:** 0.1256
- **ndcg@5:** 0.1631
- **ndcg@50:** 0.3045
- **test_loss:** 0.7703