Master/experiments/sc8_dc05_control/lightfm_hist_hm_1_month_s38210573/test_metrics.json

{
  "ndcg@1": 0.23819771718107277,
  "hit_ratio@1": 0.23819771718107277,
  "ndcg@3": 0.3438929850652654,
  "hit_ratio@3": 0.42057805987632463,
  "ndcg@5": 0.38323046495827906,
  "hit_ratio@5": 0.5162494211228854,
  "ndcg@10": 0.4268762658948617,
  "hit_ratio@10": 0.6510801165926612,
  "ndcg@50": 0.48854290948513934,
  "hit_ratio@50": 0.9241875289438557,
  "test_loss": 3.413970374064163
}

Master/experiments/sc8_dc05_control/lightfm_hist_hm_1_month_s38210573/summary.md

## All Test Metrics

- **hit_ratio@1:** 0.2382
- **hit_ratio@10:** 0.6511
- **hit_ratio@3:** 0.4206
- **hit_ratio@5:** 0.5162
- **hit_ratio@50:** 0.9242
- **ndcg@1:** 0.2382
- **ndcg@10:** 0.4269
- **ndcg@3:** 0.3439
- **ndcg@5:** 0.3832
- **ndcg@50:** 0.4885
- **test_loss:** 3.4140