Master/experiments/sc8_dc05_control/lightfm_hist_hm_1_month_s38210573/val_metrics.json

{
  "ndcg@1": 0.2542428287340979,
  "hit_ratio@1": 0.2542428287340979,
  "ndcg@3": 0.3644512832041999,
  "hit_ratio@3": 0.4443869350840393,
  "ndcg@5": 0.4038759878020517,
  "hit_ratio@5": 0.5403307090904138,
  "ndcg@10": 0.4472337138589213,
  "hit_ratio@10": 0.6742624424528045,
  "ndcg@50": 0.5058827923903464,
  "hit_ratio@50": 0.9339943882971479,
  "val_loss": 3.3038445831591243
}

Master/experiments/sc8_dc05_control/lightfm_hist_hm_1_month_s38210573/summary.md

## All Validation Metrics (at best checkpoint)

- **hit_ratio@1:** 0.2542
- **hit_ratio@10:** 0.6743
- **hit_ratio@3:** 0.4444
- **hit_ratio@5:** 0.5403
- **hit_ratio@50:** 0.9340
- **ndcg@1:** 0.2542
- **ndcg@10:** 0.4472
- **ndcg@3:** 0.3645
- **ndcg@5:** 0.4039
- **ndcg@50:** 0.5059
- **val_loss:** 3.3038