Master/experiments/results/user_item_proto_ml-1m_s38210573/test_metrics.json

{
  "ndcg@1": 0.14849187935034802,
  "hit_ratio@1": 0.14849187935034802,
  "ndcg@3": 0.2518877806915603,
  "hit_ratio@3": 0.3286377195889957,
  "ndcg@5": 0.29810717809338816,
  "hit_ratio@5": 0.4411667219091813,
  "ndcg@10": 0.3573148329694203,
  "hit_ratio@10": 0.6246271130261849,
  "ndcg@50": 0.43438183192230034,
  "hit_ratio@50": 0.9623798475306596,
  "test_loss": -3.306447982788086
}

Master/experiments/results/user_item_proto_ml-1m_s38210573/summary.md

## All Test Metrics

- **hit_ratio@1:** 0.1485
- **hit_ratio@10:** 0.6246
- **hit_ratio@3:** 0.3286
- **hit_ratio@5:** 0.4412
- **hit_ratio@50:** 0.9624
- **ndcg@1:** 0.1485
- **ndcg@10:** 0.3573
- **ndcg@3:** 0.2519
- **ndcg@5:** 0.2981
- **ndcg@50:** 0.4344
- **test_loss:** -3.3064