Master/experiments/sc8_dc05_control/lightfm_hist_ml-1m_s38210573/test_metrics.json

{
  "ndcg@1": 0.153463705667882,
  "hit_ratio@1": 0.153463705667882,
  "ndcg@3": 0.25475059046770965,
  "hit_ratio@3": 0.33012926748425586,
  "ndcg@5": 0.30061436608630043,
  "hit_ratio@5": 0.4416639045409347,
  "ndcg@10": 0.35510900708917037,
  "hit_ratio@10": 0.6107059993370898,
  "ndcg@50": 0.4324126110948256,
  "hit_ratio@50": 0.9506131919124958,
  "test_loss": 3.5626796782016754
}

Master/experiments/sc8_dc05_control/lightfm_hist_ml-1m_s38210573/summary.md

## All Test Metrics

- **hit_ratio@1:** 0.1535
- **hit_ratio@10:** 0.6107
- **hit_ratio@3:** 0.3301
- **hit_ratio@5:** 0.4417
- **hit_ratio@50:** 0.9506
- **ndcg@1:** 0.1535
- **ndcg@10:** 0.3551
- **ndcg@3:** 0.2548
- **ndcg@5:** 0.3006
- **ndcg@50:** 0.4324
- **test_loss:** 3.5627