Master/experiments/sc8_dc05_control/lightfm_hist_ml-1m_s38210573/val_metrics.json

{
  "ndcg@1": 0.16605899900563473,
  "hit_ratio@1": 0.16605899900563473,
  "ndcg@3": 0.2773997589711903,
  "hit_ratio@3": 0.3597944978455419,
  "ndcg@5": 0.3240025763088968,
  "hit_ratio@5": 0.4734835929731521,
  "ndcg@10": 0.37887088472793856,
  "hit_ratio@10": 0.6425256877693073,
  "ndcg@50": 0.4511338762299657,
  "hit_ratio@50": 0.9592310241962214,
  "val_loss": 3.4058227141698203
}

Master/experiments/sc8_dc05_control/lightfm_hist_ml-1m_s38210573/summary.md

## All Validation Metrics (at best checkpoint)

- **hit_ratio@1:** 0.1661
- **hit_ratio@10:** 0.6425
- **hit_ratio@3:** 0.3598
- **hit_ratio@5:** 0.4735
- **hit_ratio@50:** 0.9592
- **ndcg@1:** 0.1661
- **ndcg@10:** 0.3789
- **ndcg@3:** 0.2774
- **ndcg@5:** 0.3240
- **ndcg@50:** 0.4511
- **val_loss:** 3.4058