Master/experiments/results/user_item_proto_hm_1_month_s38210573/test_metrics.json

{
  "ndcg@1": 0.2144978070772835,
  "hit_ratio@1": 0.2144978070772835,
  "ndcg@3": 0.32653596293600945,
  "hit_ratio@3": 0.4082786237707374,
  "ndcg@5": 0.36961679514650997,
  "hit_ratio@5": 0.5130894331090469,
  "ndcg@10": 0.41738533295943847,
  "hit_ratio@10": 0.6606145631861396,
  "ndcg@50": 0.4790160765681596,
  "hit_ratio@50": 0.9328502547059304,
  "test_loss": -3.43367295148896
}

Master/experiments/results/user_item_proto_hm_1_month_s38210573/summary.md

## All Test Metrics

- **hit_ratio@1:** 0.2145
- **hit_ratio@10:** 0.6606
- **hit_ratio@3:** 0.4083
- **hit_ratio@5:** 0.5131
- **hit_ratio@50:** 0.9329
- **ndcg@1:** 0.2145
- **ndcg@10:** 0.4174
- **ndcg@3:** 0.3265
- **ndcg@5:** 0.3696
- **ndcg@50:** 0.4790
- **test_loss:** -3.4337