Master/experiments/results/user_item_proto_hm_1_month_s38210573/val_metrics.json

{
  "ndcg@1": 0.22656569233702906,
  "hit_ratio@1": 0.22656569233702906,
  "ndcg@3": 0.34247785988917023,
  "hit_ratio@3": 0.4270887248358713,
  "ndcg@5": 0.3866926097153872,
  "hit_ratio@5": 0.5346100411343268,
  "ndcg@10": 0.43417587183956163,
  "hit_ratio@10": 0.6813179329319785,
  "ndcg@50": 0.4933283389692192,
  "hit_ratio@50": 0.9414993598300144,
  "val_loss": -3.54636324822695
}

Master/experiments/results/user_item_proto_hm_1_month_s38210573/summary.md

## All Validation Metrics (at best checkpoint)

- **hit_ratio@1:** 0.2266
- **hit_ratio@10:** 0.6813
- **hit_ratio@3:** 0.4271
- **hit_ratio@5:** 0.5346
- **hit_ratio@50:** 0.9415
- **ndcg@1:** 0.2266
- **ndcg@10:** 0.4342
- **ndcg@3:** 0.3425
- **ndcg@5:** 0.3867
- **ndcg@50:** 0.4933
- **val_loss:** -3.5464