Master/experiments/results/acf_hm_3_month_s38210573/test_metrics.json

{
  "ndcg@1": 0.06530165445401459,
  "hit_ratio@1": 0.06530165445401459,
  "ndcg@3": 0.11471393454728164,
  "hit_ratio@3": 0.15192383356512051,
  "ndcg@5": 0.14372972710518853,
  "hit_ratio@5": 0.22272994651364816,
  "ndcg@10": 0.18851240399626001,
  "hit_ratio@10": 0.36230088702420327,
  "ndcg@50": 0.2921377268744,
  "hit_ratio@50": 0.8324237147498451,
  "test_loss": 15101.809408688
}

Master/experiments/results/acf_hm_3_month_s38210573/summary.md

## All Test Metrics

- **hit_ratio@1:** 0.0653
- **hit_ratio@10:** 0.3623
- **hit_ratio@3:** 0.1519
- **hit_ratio@5:** 0.2227
- **hit_ratio@50:** 0.8324
- **ndcg@1:** 0.0653
- **ndcg@10:** 0.1885
- **ndcg@3:** 0.1147
- **ndcg@5:** 0.1437
- **ndcg@50:** 0.2921
- **test_loss:** 15101.8094