Master/experiments/results/acf_hm_3_month_s38210573/val_metrics.json

{
  "ndcg@1": 0.06561719666070642,
  "hit_ratio@1": 0.06561719666070642,
  "ndcg@3": 0.1181398518830981,
  "hit_ratio@3": 0.15773604310072808,
  "ndcg@5": 0.14879710525802858,
  "hit_ratio@5": 0.23253902400068563,
  "ndcg@10": 0.19262338426155778,
  "hit_ratio@10": 0.36856498416445593,
  "ndcg@50": 0.2938423609768241,
  "hit_ratio@50": 0.8286644773491338,
  "val_loss": 15222.096890967721
}

Master/experiments/results/acf_hm_3_month_s38210573/summary.md

## All Validation Metrics (at best checkpoint)

- **hit_ratio@1:** 0.0656
- **hit_ratio@10:** 0.3686
- **hit_ratio@3:** 0.1577
- **hit_ratio@5:** 0.2325
- **hit_ratio@50:** 0.8287
- **ndcg@1:** 0.0656
- **ndcg@10:** 0.1926
- **ndcg@3:** 0.1181
- **ndcg@5:** 0.1488
- **ndcg@50:** 0.2938
- **val_loss:** 15222.0969