Master/experiments/results/mf_hm_1_month_s38210573/val_metrics.json

{
  "ndcg@1": 0.115285079953145,
  "hit_ratio@1": 0.115285079953145,
  "ndcg@3": 0.17194539415519108,
  "hit_ratio@3": 0.20966248059059087,
  "ndcg@5": 0.1932154864995196,
  "hit_ratio@5": 0.2556729957231197,
  "ndcg@10": 0.21735000231356277,
  "hit_ratio@10": 0.31485466779263943,
  "ndcg@50": 0.2641582645173432,
  "hit_ratio@50": 0.43993298646108586,
  "val_loss": 4.605166556527806
}

Master/experiments/results/mf_hm_1_month_s38210573/summary.md

## All Validation Metrics (at best checkpoint)

- **hit_ratio@1:** 0.1153
- **hit_ratio@10:** 0.3149
- **hit_ratio@3:** 0.2097
- **hit_ratio@5:** 0.2557
- **hit_ratio@50:** 0.4399
- **ndcg@1:** 0.1153
- **ndcg@10:** 0.2174
- **ndcg@3:** 0.1719
- **ndcg@5:** 0.1932
- **ndcg@50:** 0.2642
- **val_loss:** 4.6052