Master/experiments/results/mf_hm_1_month_s38210573/test_metrics.json

{
  "ndcg@1": 0.10468822359639325,
  "hit_ratio@1": 0.10468822359639325,
  "ndcg@3": 0.16841320308711932,
  "hit_ratio@3": 0.2148247023890599,
  "ndcg@5": 0.1949796173499095,
  "hit_ratio@5": 0.27901876923915114,
  "ndcg@10": 0.22334285173562865,
  "hit_ratio@10": 0.3651556838922335,
  "ndcg@50": 0.2686830367023013,
  "hit_ratio@50": 0.5656650957530851,
  "test_loss": 4.6051469862668775
}

Master/experiments/results/mf_hm_1_month_s38210573/summary.md

## All Test Metrics

- **hit_ratio@1:** 0.1047
- **hit_ratio@10:** 0.3652
- **hit_ratio@3:** 0.2148
- **hit_ratio@5:** 0.2790
- **hit_ratio@50:** 0.5657
- **ndcg@1:** 0.1047
- **ndcg@10:** 0.2233
- **ndcg@3:** 0.1684
- **ndcg@5:** 0.1950
- **ndcg@50:** 0.2687
- **test_loss:** 4.6051