Master/experiments/sc8_dc05_control/lightfm_hist_ids_ml-1m_s38210573/test_metrics.json

{
  "ndcg@1": 0.16705336426914152,
  "hit_ratio@1": 0.16705336426914152,
  "ndcg@3": 0.2734756012346734,
  "hit_ratio@3": 0.3513423931057342,
  "ndcg@5": 0.3224289460943004,
  "hit_ratio@5": 0.47016904209479615,
  "ndcg@10": 0.3767301128017198,
  "hit_ratio@10": 0.6373881339078555,
  "ndcg@50": 0.4510059956874684,
  "hit_ratio@50": 0.9623798475306596,
  "test_loss": 3.517253796259562
}

Master/experiments/sc8_dc05_control/lightfm_hist_ids_ml-1m_s38210573/summary.md

## All Test Metrics

- **hit_ratio@1:** 0.1671
- **hit_ratio@10:** 0.6374
- **hit_ratio@3:** 0.3513
- **hit_ratio@5:** 0.4702
- **hit_ratio@50:** 0.9624
- **ndcg@1:** 0.1671
- **ndcg@10:** 0.3767
- **ndcg@3:** 0.2735
- **ndcg@5:** 0.3224
- **ndcg@50:** 0.4510
- **test_loss:** 3.5173