Master/experiments/sc8_dc05_control/lightfm_hist_ids_ml-1m_s38210573/val_metrics.json

{
  "ndcg@1": 0.18329466357308585,
  "hit_ratio@1": 0.18329466357308585,
  "ndcg@3": 0.29917893661868805,
  "hit_ratio@3": 0.3839907192575406,
  "ndcg@5": 0.34770286835272496,
  "hit_ratio@5": 0.5019887305270135,
  "ndcg@10": 0.4027169819981224,
  "hit_ratio@10": 0.6721909181305933,
  "ndcg@50": 0.47089305072992044,
  "hit_ratio@50": 0.968677494199536,
  "val_loss": 3.3440242608388266
}

Master/experiments/sc8_dc05_control/lightfm_hist_ids_ml-1m_s38210573/summary.md

## All Validation Metrics (at best checkpoint)

- **hit_ratio@1:** 0.1833
- **hit_ratio@10:** 0.6722
- **hit_ratio@3:** 0.3840
- **hit_ratio@5:** 0.5020
- **hit_ratio@50:** 0.9687
- **ndcg@1:** 0.1833
- **ndcg@10:** 0.4027
- **ndcg@3:** 0.2992
- **ndcg@5:** 0.3477
- **ndcg@50:** 0.4709
- **val_loss:** 3.3440