Master/experiments/results/item_proto_ml-1m_s38210573/test_metrics.json

{
  "ndcg@1": 0.12512429565793834,
  "hit_ratio@1": 0.12512429565793834,
  "ndcg@3": 0.21663938795634527,
  "hit_ratio@3": 0.28471992045077893,
  "ndcg@5": 0.2610961995611365,
  "hit_ratio@5": 0.3931057341730196,
  "ndcg@10": 0.31911279670561565,
  "hit_ratio@10": 0.5722572091481605,
  "ndcg@50": 0.4034078969420867,
  "hit_ratio@50": 0.9449784554192907,
  "test_loss": 1.785186270872752
}

Master/experiments/results/item_proto_ml-1m_s38210573/summary.md

## All Test Metrics

- **hit_ratio@1:** 0.1251
- **hit_ratio@10:** 0.5723
- **hit_ratio@3:** 0.2847
- **hit_ratio@5:** 0.3931
- **hit_ratio@50:** 0.9450
- **ndcg@1:** 0.1251
- **ndcg@10:** 0.3191
- **ndcg@3:** 0.2166
- **ndcg@5:** 0.2611
- **ndcg@50:** 0.4034
- **test_loss:** 1.7852