Master/experiments/results/acf_hm_1_month_s38210573/val_metrics.json

{
  "ndcg@1": 0.1467896156255959,
  "hit_ratio@1": 0.1467896156255959,
  "ndcg@3": 0.24400345235695703,
  "hit_ratio@3": 0.3157672505380152,
  "ndcg@5": 0.28816462712268537,
  "hit_ratio@5": 0.42323408428450787,
  "ndcg@10": 0.34150116423632076,
  "hit_ratio@10": 0.5883570786455637,
  "ndcg@50": 0.4135928088937544,
  "hit_ratio@50": 0.9053774278787219,
  "val_loss": 9605.151906508601
}

Master/experiments/results/acf_hm_1_month_s38210573/summary.md

## All Validation Metrics (at best checkpoint)

- **hit_ratio@1:** 0.1468
- **hit_ratio@10:** 0.5884
- **hit_ratio@3:** 0.3158
- **hit_ratio@5:** 0.4232
- **hit_ratio@50:** 0.9054
- **ndcg@1:** 0.1468
- **ndcg@10:** 0.3415
- **ndcg@3:** 0.2440
- **ndcg@5:** 0.2882
- **ndcg@50:** 0.4136
- **val_loss:** 9605.1519