Master/experiments/results/acf_hm_1_month_s38210573/test_metrics.json

{
  "ndcg@1": 0.13793620093165163,
  "hit_ratio@1": 0.13793620093165163,
  "ndcg@3": 0.2330464891246527,
  "hit_ratio@3": 0.30337246996649325,
  "ndcg@5": 0.27725863172435744,
  "hit_ratio@5": 0.4110027513688741,
  "ndcg@10": 0.3307073400591423,
  "hit_ratio@10": 0.5764117791277343,
  "ndcg@50": 0.4039472025886471,
  "hit_ratio@50": 0.8976953880519764,
  "test_loss": 9836.7020106299
}

Master/experiments/results/acf_hm_1_month_s38210573/summary.md

## All Test Metrics

- **hit_ratio@1:** 0.1379
- **hit_ratio@10:** 0.5764
- **hit_ratio@3:** 0.3034
- **hit_ratio@5:** 0.4110
- **hit_ratio@50:** 0.8977
- **ndcg@1:** 0.1379
- **ndcg@10:** 0.3307
- **ndcg@3:** 0.2330
- **ndcg@5:** 0.2773
- **ndcg@50:** 0.4039
- **test_loss:** 9836.7020