Master/experiments/results/item_proto_hm_1_month_s38210573/test_metrics.json

{
  "ndcg@1": 0.08713122122640224,
  "hit_ratio@1": 0.08713122122640224,
  "ndcg@3": 0.16859598278132668,
  "hit_ratio@3": 0.22987550736876516,
  "ndcg@5": 0.21150253067169705,
  "hit_ratio@5": 0.3343594213952982,
  "ndcg@10": 0.2630246826971008,
  "hit_ratio@10": 0.4937345065242856,
  "ndcg@50": 0.3415074118733326,
  "hit_ratio@50": 0.8419597373940996,
  "test_loss": 0.3830873791764422
}

Master/experiments/results/item_proto_hm_1_month_s38210573/summary.md

## All Test Metrics

- **hit_ratio@1:** 0.0871
- **hit_ratio@10:** 0.4937
- **hit_ratio@3:** 0.2299
- **hit_ratio@5:** 0.3344
- **hit_ratio@50:** 0.8420
- **ndcg@1:** 0.0871
- **ndcg@10:** 0.2630
- **ndcg@3:** 0.1686
- **ndcg@5:** 0.2115
- **ndcg@50:** 0.3415
- **test_loss:** 0.3831