Master/experiments/results/item_proto_hm_1_month_s38210573/val_metrics.json

{
  "ndcg@1": 0.08582363997929664,
  "hit_ratio@1": 0.08582363997929664,
  "ndcg@3": 0.16797007956996943,
  "hit_ratio@3": 0.2297665422648397,
  "ndcg@5": 0.21244017775112534,
  "hit_ratio@5": 0.3380642349287641,
  "ndcg@10": 0.2653437366532178,
  "hit_ratio@10": 0.5015391320929472,
  "ndcg@50": 0.3438718268883589,
  "hit_ratio@50": 0.850159361464491,
  "val_loss": 0.36279725945369706
}

Master/experiments/results/item_proto_hm_1_month_s38210573/summary.md

## All Validation Metrics (at best checkpoint)

- **hit_ratio@1:** 0.0858
- **hit_ratio@10:** 0.5015
- **hit_ratio@3:** 0.2298
- **hit_ratio@5:** 0.3381
- **hit_ratio@50:** 0.8502
- **ndcg@1:** 0.0858
- **ndcg@10:** 0.2653
- **ndcg@3:** 0.1680
- **ndcg@5:** 0.2124
- **ndcg@50:** 0.3439
- **val_loss:** 0.3628