Master/experiments/results/item_proto_amazon2014_s38210573/val_metrics.json

{
  "ndcg@1": 0.11985611510791366,
  "hit_ratio@1": 0.11985611510791366,
  "ndcg@3": 0.19944152161202697,
  "hit_ratio@3": 0.25841726618705035,
  "ndcg@5": 0.23451747916098042,
  "hit_ratio@5": 0.3437410071942446,
  "ndcg@10": 0.2828790759960875,
  "hit_ratio@10": 0.4935251798561151,
  "ndcg@50": 0.3677253868754641,
  "hit_ratio@50": 0.8753956834532374,
  "val_loss": 1.2605515377862113
}

Master/experiments/results/item_proto_amazon2014_s38210573/summary.md

## All Validation Metrics (at best checkpoint)

- **hit_ratio@1:** 0.1199
- **hit_ratio@10:** 0.4935
- **hit_ratio@3:** 0.2584
- **hit_ratio@5:** 0.3437
- **hit_ratio@50:** 0.8754
- **ndcg@1:** 0.1199
- **ndcg@10:** 0.2829
- **ndcg@3:** 0.1994
- **ndcg@5:** 0.2345
- **ndcg@50:** 0.3677
- **val_loss:** 1.2606