Master/experiments/results/item_proto_amazon2014_s38210573/test_metrics.json

{
  "ndcg@1": 0.08532374100719424,
  "hit_ratio@1": 0.08532374100719424,
  "ndcg@3": 0.1498615733134653,
  "hit_ratio@3": 0.19827338129496402,
  "ndcg@5": 0.17890686663437574,
  "hit_ratio@5": 0.2689208633093525,
  "ndcg@10": 0.21929165293649452,
  "hit_ratio@10": 0.3949640287769784,
  "ndcg@50": 0.3133940461568554,
  "hit_ratio@50": 0.8277697841726619,
  "test_loss": 1.4533813084874834
}

Master/experiments/results/item_proto_amazon2014_s38210573/summary.md

## All Test Metrics

- **hit_ratio@1:** 0.0853
- **hit_ratio@10:** 0.3950
- **hit_ratio@3:** 0.1983
- **hit_ratio@5:** 0.2689
- **hit_ratio@50:** 0.8278
- **ndcg@1:** 0.0853
- **ndcg@10:** 0.2193
- **ndcg@3:** 0.1499
- **ndcg@5:** 0.1789
- **ndcg@50:** 0.3134
- **test_loss:** 1.4534