Master/experiments/results/user_proto_hm_1_month_s38210573/val_metrics.json

{
  "ndcg@1": 0.14920046854994687,
  "hit_ratio@1": 0.14920046854994687,
  "ndcg@3": 0.24598639239516265,
  "hit_ratio@3": 0.3176877604947016,
  "ndcg@5": 0.28920787939050385,
  "hit_ratio@5": 0.42292080961072215,
  "ndcg@10": 0.34078276730208734,
  "hit_ratio@10": 0.5823503772916724,
  "ndcg@50": 0.4149931753420067,
  "hit_ratio@50": 0.9102944781933586,
  "val_loss": 0.05323411944851227
}

Master/experiments/results/user_proto_hm_1_month_s38210573/summary.md

## All Validation Metrics (at best checkpoint)

- **hit_ratio@1:** 0.1492
- **hit_ratio@10:** 0.5824
- **hit_ratio@3:** 0.3177
- **hit_ratio@5:** 0.4229
- **hit_ratio@50:** 0.9103
- **ndcg@1:** 0.1492
- **ndcg@10:** 0.3408
- **ndcg@3:** 0.2460
- **ndcg@5:** 0.2892
- **ndcg@50:** 0.4150
- **val_loss:** 0.0532