Master/experiments/expl_deep_dive/1.1_user_proto_hm_1_month_s38210573/test_metrics.json

{
  "ndcg@1": 0.1437522133536735,
  "hit_ratio@1": 0.1437522133536735,
  "ndcg@3": 0.2370531148862898,
  "hit_ratio@3": 0.30616470075458335,
  "ndcg@5": 0.2798606001426904,
  "hit_ratio@5": 0.4104170639352747,
  "ndcg@10": 0.3322456593427424,
  "hit_ratio@10": 0.5724617941104362,
  "ndcg@50": 0.4076976735048972,
  "hit_ratio@50": 0.9067803535917622,
  "test_loss": 0.0946288922937905
}

Master/experiments/results/user_proto_hm_1_month_s38210573/summary.md

## All Test Metrics

- **hit_ratio@1:** 0.1438
- **hit_ratio@10:** 0.5725
- **hit_ratio@3:** 0.3062
- **hit_ratio@5:** 0.4104
- **hit_ratio@50:** 0.9068
- **ndcg@1:** 0.1438
- **ndcg@10:** 0.3322
- **ndcg@3:** 0.2371
- **ndcg@5:** 0.2799
- **ndcg@50:** 0.4077
- **test_loss:** 0.0946